{
  "placement": "page",
  "id": "locations.default",
  "type": "locations",
  "variant": "default",
  "contract": "./contract.schema.json",
  "definition": "./definition.tsx",
  "capability": {
    "title": "Kitchen Locations",
    "description": "Multi-location block for a restaurant group: one address card per kitchen with street address, phone, opening hours and a pickup action, paired with an embedded map and a pickup note.",
    "useWhen": ["The brand runs several kitchens and the page must list addresses, phones and opening hours"],
    "avoidWhen": ["The brand has a single address that only needs a map and a phone number"],
    "rendering": "server"
  }
}
