{
  "placement": "page",
  "id": "order-cta.default",
  "type": "order-cta",
  "variant": "default",
  "contract": "./contract.schema.json",
  "definition": "./definition.tsx",
  "capability": {
    "title": "Order Call To Action",
    "description": "Deep brand-green ordering band with a heading, supporting line, primary and secondary actions, and an optional dish photograph beside the copy. The single high-contrast brand moment on a page.",
    "useWhen": ["A page should close a section or its content with the strongest ordering prompt"],
    "avoidWhen": ["The page already opens with a full ordering hero that carries the same actions"],
    "rendering": "server"
  }
}
