{
  "placement": "page",
  "id": "seasonal-picks.default",
  "type": "seasonal-picks",
  "variant": "default",
  "contract": "./contract.schema.json",
  "definition": "./definition.tsx",
  "capability": {
    "title": "Seasonal Picks",
    "description": "Cards for the dishes currently peaking in season: photograph, optional status badge, dish name, one-line description and price, plus a heading action that points to the full menu.",
    "useWhen": ["A page should highlight a handful of rotating, in-season dishes with prices"],
    "avoidWhen": ["The page needs the complete filtered list of every dish on the menu"],
    "rendering": "server"
  }
}
